### ISSUE TITLE
Mini Trooper cameras don't show

### ISSUE THREAD

**Issue by AlbertoLopSie** [RenierM26/py-ezviz#4]
Hi Renier!

I have a couple of (discontinued??) [EzViz Mini Trooper](https://www.ezvizlife.com/us/product/mini-trooper/848) cams connected a CS-W2S Base Station

When queried with `pyezviz -u USER -p PASSWORD --region sa devices status` I get:
```
      serial                 name              version  upgrade_available  ... battery_level PIR_Status  last_alarm_time last_alarm_pic
0  83179xxxx               Living  V5.2.0 build 170210                  0  ...          None          0             None           None
1  D0530xxxx  Test-C3A(D05301327)  V5.2.4 build 190402                  0  ...            60          0             None           None
2  16719xxxx              Galeria  V5.3.0 build 180108                  0  ...          None          0             None           None
```

My CS-W2S Base Station doesn't show. If I query the cam status using my known serial number I get:
```
pyezviz -u USER -p PASSWORD --region sa camera --serial 80985xxxx status
{
  "serial": "80985xxxx",
  "name": "Exterior",
  "version": "V1.5.8 build 171120",
  "upgrade_available": 0,
  "status": "1",
  "device_sub_category": "W2S",
  "sleep": null,
  "privacy": null,
  "audio": false,
  "ir_led": null,
  "state_led": null,
  "follow_move": null,
  "alarm_notify": false,
  "alarm_schedules_enabled": false,
  "alarm_sound_mod": "NOTIFY_MODE",
  "encrypted": false,
  "local_ip": "192.168.1.242",
  "local_rtsp_port": 0,
  "detection_sensibility": null,
  "battery_level": null,
  "PIR_Status": 0,
  "last_alarm_time": null,
  "last_alarm_pic": null
}
```

This base station has 2 channels I can watch using either the iOS app or the ezvizlife.com website.

Any hint on how to watch theese cameras (I pretend to watch them on Home Assistant using your ha-ezviz integration)

NOTE: the `--region` command line option is in [my PR](https://github.com/RenierM26/py-ezviz/pull/3). I'm in Argentina, and py-ezviz does not work without specifying `sa` (south america) region.

**Comment by AlbertoLopSie** [comment]
Result of `devices device`
```
pyezviz -u USER -p PASSW -r sa devices device
[
  {
    "name": "Exterior",
    "deviceSerial": "80985xxxx",
    "fullSerial": "CS-W2S-A10820170805CCRR809856076",
    "deviceType": "CS-W2S-A1",
    "devicePicPrefix": "https://devpic.ezvizlife.com/device/image/CS-W2S-A1/",
    "version": "V1.5.8 build 171120",
    "supportExt": "{\"46\":\"1\",\"26\":\"4\",\"154\":\"0\",\"330\":\"1\",\"232\":\"0\",\"233\":\"0\",\"234\":6,\"236\":\"1\",\"237\":\"1\",\"30\":\"0\",\"52\":\"1\",\"31\":\"0\",\"10\":\"1\",\"11\":\"1\",\"12\":\"1\",\"13\":\"0\",\"15\":\"1\",\"59\":\"1\",\"1\":\"1\",\"2\":\"0\",\"3\":\"2\",\"4\":\"1\",\"5\":\"0\",\"6\":\"0\",\"7\":\"0\",\"8\":\"0\",\"80\":\"1\",\"9\":\"1\",\"84\":\"1\",\"63\":\"1\"}",
    "status": 1,
    "userDeviceCreateTime": "2018-08-11 21:24:37",
    "casIp": "sacas.ezvizlife.com",
    "casPort": 6500,
    "channelNumber": 6,
    "hik": false,
    "deviceCategory": "XVR",
    "deviceSubCategory": "W2S",
    "ezDeviceCapability": "{\"232\":\"0\",\"233\":\"0\",\"234\":1,\"268\":\"1\",\"30\":\"0\",\"31\":\"0\",\"262\":\"0\",\"175\":\"1\"}",
    "customType": "CS-W2S-A1",
    "offlineTime": "2021-01-05 18:11:47",
    "offlineNotify": 0,
    "accessPlatform": true,
    "deviceDomain": "80985xxxx",
    "instructionBook": "http://devpic.ezvizlife.com/device/image/CS-W2S-A1/instruction.jpeg",
    "deviceShareInfo": null,
    "feature": null,
    "riskLevel": 0,
    "offlineTimestamp": 1609870307000
  },
  ...
```
Only remarkable fields seems to be:
```
    "channelNumber": 6,

    "supportExt": "{\"46\":\"1\",\"26\":\"4\",\"154\":\"0\",\"330\":\"1\",\"232\":\"0\",\"233\":\"0\",\"234\":6,\"236\":\"1\",\"237\":\"1\",\"30\":\"0\",\"52\":\"1\",\"31\":\"0\",\"10\":\"1\",\"11\":\"1\",\"12\":\"1\",\"13\":\"0\",\"15\":\"1\",\"59\":\"1\",\"1\":\"1\",\"2\":\"0\",\"3\":\"2\",\"4\":\"1\",\"5\":\"0\",\"6\":\"0\",\"7\":\"0\",\"8\":\"0\",\"80\":\"1\",\"9\":\"1\",\"84\":\"1\",\"63\":\"1\"}",

    "ezDeviceCapability": "{\"232\":\"0\",\"233\":\"0\",\"234\":1,\"268\":\"1\",\"30\":\"0\",\"31\":\"0\",\"262\":\"0\",\"175\":\"1\"}",
```

I can't interpret `supportExt` or `ezDeviceCapability`   Can you?
They look like json strings. properly formatted they look like:
```
    "supportExt": {
        "46":"1",
        "26":"4",
        "154":"0",
        "330":"1",
        "232":"0",
        "233":"0",
        "234":6,
        "236":"1",
        "237":"1",
        "30":"0",
        "52":"1",
        "31":"0",
        "10":"1",
        "11":"1",
        "12":"1",
        "13":"0",
        "15":"1",
        "59":"1",
        "1":"1",
        "2":"0",
        "3":"2",
        "4":"1",
        "5":"0",
        "6":"0",
        "7":"0",
        "8":"0",
        "80":"1",
        "9":"1",
        "84":"1",
        "63":"1"
    },

    "ezDeviceCapability": {
         "232":"0",
         "233":"0",
         "234":1,
         "268":"1",
         "30":"0",
         "31":"0",
         "262":"0",
         "175":"1"
    }
```

Do they have any meaning to you??

**Comment by AlbertoLopSie** [comment]
[PR #3](https://github.com/RenierM26/py-ezviz/pull/3) now lists CS-W2S Base Station

Modified panda output to show only selected (most useful) fields

**Comment by RenierM26** [comment]
Hi Alberto,

supportExt shows type and supported option. This url : https://ieu.ezvizlife.com/camera/cameraAction!findAlarmDevices.action actually returns names instead of numbers.

{\"support_ap_allseries\":\"1\",
\"support_battery_manage\":\"1\",
\"support_auto_sleep\":\"1\",
\"support_smart_wifi\":\"1\",
\"ptz_left_right\":\"0\",
\"support_cloud\":\"1\",
\"support_smart_googlehome\":\"1\",
\"support_upgrade\":\"1\",
\"support_audio_onoff\":\"1\",
\"support_auto_offline\":\"0\",
\"support_close_infrared_light\":\"1\",
\"support_timezone\":\"1\",
\"support_managed_delete\":\"1\",
\"ptz_top_bottom\":\"0\",
\"support_channel_number\":1,
\"support_defence\":\"1\",
\"support_device_wired\":\"0\",
\"support_defenceplan\":\"1\",
\"support_resolution\":\"16-9\",
\"support_disk\":\"1\",
\"support_smart_alexa\":\"1\",
\"support_cloud_version\":\"1\",
\"support_remote_auth_randcode\":\"1\",
\"support_encrypt\":\"1\",
\"ptz_center_mirror\":\"0\",
\"support_ptz\":\"0\",
\"support_talk\":\"3\",
\"support_alarm_voice\":\"1\",
\"support_ap_mode\":\"2\",
\"support_wifi_userId\":\"1\",
\"support_wifi\":\"3\",
\"support_weixin\":\"1\",
\"support_sensibility_adjust\":\"3\",
\"support_modify_pwd\":\"1\",
\"support_related_device\":\"0\"}

\"support_sensibility_adjust\":\"3\", ----> This indicates that my battery cam makes use of detection sensitivity type 3. (Which should be PIR. (other cameras might use IR and i suspect this would be type 0)

**Comment by RenierM26** [comment]
Number version of "supportExt" for above. The list orders are not the same so it makes is difficult to determine the correct number for each "sensor type"

{\"24\":\"1\",
\"46\":\"1\",
\"26\":\"0\",
\"48\":\"1\",
\"28\":\"1\",
\"152\":\"1\",
\"154\":\"0\",
\"232\":\"1\",
\"178\":\"1\",
\"233\":\"1\",
\"234\":1,
\"236\":\"1\",
\"237\":\"1\",
\"119\":\"1\",
\"30\":\"0\",
\"31\":\"0\",
\"10\":\"1\",
\"11\":\"1\",
\"12\":\"1\",
\"13\":\"3\",
\"15\":\"1\",
\"37\":\"0\",
\"16\":\"16-9\",
\"141\":\"0\",
\"1\":\"1\",
\"144\":\"1\",
\"2\":\"3\",
\"3\":\"1\",
\"4\":\"1\",
\"7\":\"1\",
\"106\":\"2\",
\"8\":\"0\",
\"9\":\"1\",
\"61\":\"3\",
\"63\":\"1\"}

**Comment by RenierM26** [comment]
I'm almost sure they use something similar to SOAP in their android API but it's difficult to reverse engineer 
This site list the methods but I can't find the corresponding xml (or the full urls for that fact)
https://open.ys7.com/doc/en/android/

Kind of hoping i can find something more reliable to set/query without a trial and error approach.

**Comment by AlbertoLopSie** [comment]
py-ezviz is using the API to get the local LAN IP address of the cameras and then opens an RTSP feed at the standard (554) port on that local IP.

The problem is that not all EzViz cameras support local LAN streaming (Mini Tropper don't). iOS/Android and Web players use (in my opinion) a cloud streaming endpoint. That the only way of accessing the video feed when you are out of your local (home) LAN.

Some time ago I spent some time trying to "debug" ezvizlife.com web access portal javascript and realized that. Unfortunately I gave up before discovering the actual API endpoints used by the JS code at that site.

Do you know where to find some documentation about the ezviz API?  Did BaQs reveal where did he got the API calls he's using?

**Comment by RenierM26** [comment]
Hi,

I'm mostly using "fiddler" and reverse engineering the https site. (Works on IE) There are some api documentation available on https://open.ys7.com/doc/en/HTTP/device_option.html and the Ezviz api can be downloaded from Maven. The android .aar file can be exctracted with 7zip, then open classes.jar with jd-gui. Most of the api endpoints don't work and i suspect their api mostly caters for a custom cloud instance. (Or require a specific header not to give error 401).

**Comment by AlbertoLopSie** [comment]
Well.. Amazing!!  Yesterday, I spent almost the whole day doing almost the same thing!!!

I researched the ezvizlife.com using Fiddler on a Safari (I'm on Mac) browser, and although I arrived to the same dead-end I think I gather some interesting info I guess would be helpful to share.
>DISCLAIMER: This wil be a quite lengthly post dscribing in sequence all my findings. Besides documenting them, I aspire to serve as inspiration for someone picking-up from here and get to the final result: **Being able to consume EzViz camera feeds using entirely the API (and not the local LAN IP addresses), the way Android, iOS and Web apps do**.

## Fiddler
Using Fiiddler I tracked a couple of interesting API calls, one of the is used in your code but the other not:

```
https://isa.ezvizlife.com/camera/cameraAction!findAllDevices.action?noCache=0.007928759443500799
https://isa.ezvizlife.com/camera/page/query.json?noCache=0.5162913240225756?noCache=1610746553110
```
The noCache params are random and changes on every call.

These two API endpoints returns almost identical JSON responses, but the last one have some interesting fields. Here is an extract of that JSON response with the fields I consider worth to note (some sensitive fields obfuscated):

``` JSON
    "cameraDtos": [
    {
      "name": "Entrada",
      "cameraId": "xxxxxxxxxxxxxxxxxxxxxxxxxxxxx",
      "deviceSerial": "nnnnnnnnnnnnn",
      "fullSerial": "CS-CV206-C0-xxxxxxxxxxxxxxxxxxxxxxxxxxxxx",
      "fullModel": "CS-CV206-C0-3B2WFR",
      "supportWifi": 3,
      "hikPort": 9010,
      "md5Serial": "/assets/imgs/public/homeDevice",
      "mobileRand": "",
      "type": 0,
      "model": "CS-CV206-C0-3B2WFR",
      "modelType": "UNKNOWN",
      "channelNo": 1,
      "deviceIP": "24.232.nnn.nnn",   // My external IP
      "devicePort": 0,
      "cmdPort": 0,
      "httpPort": 0,
      "httpsPort": 0,
      "rtspPort": 0,
      "streamPort": 0,
      "localDeviceIP": "192.168.1.xxx",  // My Internal camera IP
      "localDevicePort": 0,
      "localCmdPort": 9010,
      "localHttpPort": 0,
      "localHttpsPort": 0,
      "localRtspPort": 0,
      "localStreamPort": 9020,
      "defaultPassword": "12345",
      "plainPassword": "xxxxxxxxxxxxxxxxxxxxxxxxxxxxxxxxxxxxxxxxxxxxxxxxxxxxxxxx",
      "userId": "xxxxxxxxxxxxxxxxxxxxxxxxxxxxxxxxxxxxxxxxxxxxxxxxx",
      "userName": "admin",
      "casDomain": "sacas.ezvizlife.com",
      "casIp": "sacas.ezvizlife.com",
      "casPort": 6500,
      "capability": "0-2-1-1",
      "encryptPwd": "xxxxxxxxxxxxxxxxxxxxxxxxxxxxxxxxxxx",
      "authSvrAddr": "https://saauth.ezvizlife.com",
      "vtmIp": "49.51.77.220",
      "vtmPort": 10554,
      "ttsIp": "ttssa.ezvizlife.com",
      "ttsPort": 9664,
      "deviceCategory": "Mini O Plus",
    },
```
This is an extract of only some fields (you can get all them calling that endpoint or I can share the full JSON if you need it)

Pay attention to two fields, they become meaningfull later in my story:
```JSON
      "vtmIp": "49.51.77.220",
      "vtmPort": 10554,
```
After that, no further activity is captured by Fiddler. Total silence.

## EzViz Javascript code
I managed to single step the javascript code on EzViz web app, and get to the point of the call to the video plugin:
```js
    return me.el.HWP_Play_V17(
            iWndNum || 0,
            sessionId, 
            iPlayType, 
            JSON.stringify(devInfo), 
            JSON.stringify(serverInfo), 
            startTime || '', 
            endTime || '',
            forceStreamType
    );
```

>*Note: I've downloaded several js files containing web app logic, many related to video playing on different kind/versions of cameras/cloud software. I didn't spend too much time on them, but if anyone is interested I'll happily share that code.*

On that plugin call `devinfo` and `serverinfo` contains several values extracted from the previous JSON struct:

``` js
devInfo: {
    Channel: 1,
    ChannelSerial: undefined,
    ISP: 0,
    InnerCmdPort: 9010,
    InnerIP: "192.168.1.xxx",  // My Internal camera IP
    InnerStreamPort: 9020,
    InternetCmdPort: 0,
    InternetIP: "24.232.nnn.nnn",   // My external IP
    InternetStreamPort: 0,
    IsEncrypt: false,
    NATType: 3,
    PermanentKey: "",
    PermanentKeyMd5: "xxxxxxxxxxxxxxxxxx",
    Serial: "xxxxxxxxx",
    StreamType: 1,
    TransProto: "TCP",
    UserName: "xxxxxxx",
    VtduTimeLimit: 0,
    videoScale: "16:9"
}

serverinfo{
    serverInfo: Object,
    casIP: "sacas.ezvizlife.com",
    casPort: 6500,
    stunIP: "49.51.85.190",
    stunPort: 6002,
    tokenUrl: "https://saauth.ezvizlife.com",
    vtmIP: "49.51.77.220",
    vtmPort: 10554
}
```
`vtmIP` and `vtmPort` Again!!

## Video Playback Plugin
The video playback plugin is a piece of native code, on the form of an ActiveX on IE/Windows and a Safari Plugin on Mac.

```HTML
<script>
// 生成插件DOM
if(util.browser.isIE || !!( window.ActiveXObject || "ActiveXObject" in window )) { // IE浏览器
	document.write("<object style='position:absolute;left:-9999px;top:0' name=\"shipin7Plugin\" width=\"1\" height=\"1\" id=\"shipin7Plugin\" style=\"position:absolute;\" classid=\"clsid:955CC7B1-B517-469d-B10B-A41B39A8225E\">");
	document.write("	<param name=\"wndtype\" value=\"1\"/>");
	document.write("	<param name=\"wmode\" value=\"opaque\"/>");
	document.write("	<param name=\"palymode\" value=\"undefined\"/>");
	document.write("</object>");
} else { //非IE浏览器
	document.write("<embed style='position:absolute;left:-9999px;top:0;' type=\"application/hwp-shipin7-plugin\" id=\"shipin7Plugin\" width=\"1\" height=\"1\" align=\"center\" wndtype=\"1\" style=\"position:absolute;\" playmode=\"undefined\">");
}
```

## Wireshark to the rescue
As said before, after the call to `HWP_Play_V17` no further activity is recorded on Fiddler. I managed to capture the plugin traffic using the capture function my firewall utility (Little Snitch) have. Liitle Snitch produces a .PCAP file that can be opened an analyzed with Wireshark.

On Wireshark I discovered that that plugin is opening an RTSP connection with the `IP-address:PORT` described in `vtmIP:vtmPort`

```
Frame 267: 326 bytes on wire (2608 bits), 326 bytes captured (2608 bits)
Ethernet II, Src: 00:00:00_00:00:00 (00:00:00:00:00:00), Dst: 00:00:00_00:00:00 (00:00:00:00:00:00)
Internet Protocol Version 4, Src: 0.1.109.159, Dst: 49.51.77.220
Transmission Control Protocol, Src Port: 4983, Dst Port: 10554, Seq: 1, Ack: 1, Len: 272
Real Time Streaming Protocol
    Request: DESCRIBE rtsp://49.51.77.220:10554/hcnp://<CAM-SERIAL-NUM>:1:1:1:0:54.232.107.205:6500?NULL:ut.1cvq06947rgv74ncc75o8l26cs732uqk-xxxxxxxxxxxx-105r4zi-i1cvrfwud:0:0 RTSP/1.0\r\n
        Method: DESCRIBE
        URL: rtsp://49.51.77.220:10554/hcnp://<CAM-SERIAL-NUM>:1:1:1:0:54.232.107.205:6500?NULL:ut.1cvq06947rgv74ncc75o8l26cs732uqk-xxxxxxxxxxxx-105r4zi-i1cvrfwud:0:0
    CSeq:0\r\n
    Accept:application/sdp\r\n
    StandardStream:0\r\n
    Device-PushData:0\r\n
    Download:0\r\n
    User-Agent:StreamClient\r\n
    \r\n

Real Time Streaming Protocol
    Response: RTSP/1.0 302 Moved Temporarily\r\n
        Status: 302
    CSeq: 0\r\n
    Server: ys7-vtm v2.15.5 build 20201105\r\n
    Location: rtsp://49.51.82.21:9554/hcnp://<CAM-SERIAL-NUM>:1:1:1:0:54.232.107.205:6500?NULL:ut.1cvq06947rgv74ncc75o8l26cs732uqk-xxxxxxxxxxxx-105r4zi-i1cvrfwud:0:0\r\n
    \r\n
```

Please note how the server identifies itself:
```
Server: ys7-vtm v2.15.5 build 20201105
```

The first RTSP connection attempt inavariably gets an `302 Moved Temporarily` response, and the next attempts are performed over the new RTSP server (`rtsp://49.51.82.21:9554`) Pay attention to the sequence of methods `DESCRIBE`, `SETUP` and `PLAY`.

``` PCAP
Real Time Streaming Protocol
    Request: DESCRIBE rtsp://49.51.82.21:9554/hcnp://<CAM-SERIAL-NUM>:1:1:1:0:54.232.107.205:6500?NULL:ut.1cvq06947rgv74ncc75o8l26cs732uqk-xxxxxxxxxxxx-105r4zi-i1cvrfwud:0:0 RTSP/1.0\r\n
        Method: DESCRIBE
        URL: rtsp://49.51.82.21:9554/hcnp://<CAM-SERIAL-NUM>:1:1:1:0:54.232.107.205:6500?NULL:ut.1cvq06947rgv74ncc75o8l26cs732uqk-xxxxxxxxxxxx-105r4zi-i1cvrfwud:0:0
    CSeq:1\r\n
    Accept:application/sdp\r\n
    StandardStream:0\r\n
    Device-PushData:0\r\n
    Download:0\r\n
    User-Agent:StreamClient\r\n
    \r\n

Real Time Streaming Protocol
    Request: SETUP rtsp://49.51.82.21:9554/hcnp://<CAM-SERIAL-NUM>:1:1:1:0:54.232.107.205:6500?NULL:ut.1cvq06947rgv74ncc75o8l26cs732uqk-xxxxxxxxxxxx-105r4zi-i1cvrfwud:0:0 RTSP/1.0\r\n
        Method: SETUP
        URL: rtsp://49.51.82.21:9554/hcnp://<CAM-SERIAL-NUM>:1:1:1:0:54.232.107.205:6500?NULL:ut.1cvq06947rgv74ncc75o8l26cs732uqk-xxxxxxxxxxxx-105r4zi-i1cvrfwud:0:0
    CSeq:2\r\n
    Transport: RTP/AVP/TCP;unicast;client_port=5000-5001;ssrc=0
    User-Agent:StreamClient\r\n
    \r\n

Real Time Streaming Protocol
    Request: PLAY rtsp://49.51.82.21:9554/hcnp://<CAM-SERIAL-NUM>:1:1:1:0:54.232.107.205:6500?NULL:ut.1cvq06947rgv74ncc75o8l26cs732uqk-xxxxxxxxxxxx-105r4zi-i1cvrfwud:0:0 RTSP/1.0\r\n
        Method: PLAY
        URL: rtsp://49.51.82.21:9554/hcnp://<CAM-SERIAL-NUM>:1:1:1:0:54.232.107.205:6500?NULL:ut.1cvq06947rgv74ncc75o8l26cs732uqk-xxxxxxxxxxxx-105r4zi-i1cvrfwud:0:0
    CSeq:3\r\n
    Session: Gh89sd320532satx_cen49.51.82.21
    Range:npt=now-\r\n
    User-Agent:StreamClient\r\n
    \r\n
```
* I omitted the `200 OK` responses, obfuscated some parts of the MRL (I guess i may be an encrypted/hashed password) and my camera serial number.

This is an strange (at least to me) RTSP MRL but, according to the PCAP, playing takes place and is recorded in the rest of the capture file.

>**I WAS NEVER ABLE to use that MRL to open a RTSP stream using VLC!** The connection opens (indicating there's an open listening port there) but no video playback is got.

One interesting thing arises from the `200 OK` responses this second server returns:
```
Real Time Streaming Protocol
    Response: RTSP/1.0 200 OK\r\n
        Status: 200
    Content-type: application/sdp
    Content-length: 555
    CSeq:1\r\n
    Server: Hikvision RTSP server Release v3.11.11 build 20201210\r\n
    \r\n
    Session Description Protocol
```
It IS undoubtely an RTSP server, a Hikvision one !!!

I guess that RTSP protocol (a fake one IMHO) is responsible for establishing the inward connection into my local LAN and extracting the video feed from my cams (wake them up when necessary), in fact, when trying to watch battery cams, the server sends several keep-alive messages to avoid connection timeout while the cam feed begins to flow.

## Conclusion
I am not being able (yet) to access MY cameras using the EzViz API, but I guess that the way to do it is figuring out the way of getting a video feed from that Hikvision RTSP server.

I hope someone else could pick up from here and gets to the end!

**Comment by AlbertoLopSie** [comment]
> Hi,
> 
> I'm mostly using "fiddler" and reverse engineering the https site. (Works on IE) There are some api documentation available on https://open.ys7.com/doc/en/HTTP/device_option.html and the Ezviz api can be downloaded from Maven. The android .aar file can be exctracted with 7zip, then open classes.jar with jd-gui. Most of the api endpoints don't work and i suspect their api mostly caters for a custom cloud instance. (Or require a specific header not to give error 401).

I think that API is meant for a different kind of service offered by EzViz. I was browsing their methods and found no similarity with ones used by you or BaQs in this project.

However, I downloaded all the available SDKs (Android, iOS and JavaScript) and plan to invest some time looking for anything useful there.
